{
  "auf": "1.0",
  "kind": "unit-definition",
  "unit": {
    "name": "Task 17: translated corpus (conditional settlement)",
    "summary": "A task with an escrowed bounty and conditional settlement. The escrow is a container while funded, a pledge while delivery awaits acceptance, a valve and a conductor when it pays out. The bounty balance, the worker's fulfillment claim and the buyer's obligation are three different valuations.",
    "tags": [
      "task",
      "escrow",
      "conditional-settlement"
    ]
  },
  "elements": [
    {
      "kind": "task",
      "ref": "eip155:11155111/erc721:0x00000000000000000000000000000000000000bb/17",
      "label": "Task tender 17 (translation corpus)"
    },
    {
      "kind": "financial-position",
      "ref": "urn:x:escrow:task-17",
      "label": "Escrowed bounty held by the tender"
    },
    {
      "kind": "agent",
      "ref": "eip155:11155111:0x00000000000000000000000000000000000000b1",
      "label": "Buyer (tender creator and funder)"
    },
    {
      "kind": "agent",
      "ref": "eip155:11155111:0x00000000000000000000000000000000000000c1",
      "label": "Worker (accepted fulfiller)"
    },
    {
      "kind": "agent",
      "ref": "eip155:11155111:0x00000000000000000000000000000000000000d1",
      "label": "Acceptance authority"
    },
    {
      "kind": "data",
      "ref": "urn:x:deliverable:task-17:translated-corpus",
      "label": "Deliverable (translated corpus)"
    }
  ],
  "relations": [
    {
      "type": "owns",
      "from": "unit",
      "to": "0x7f20c153c6f7cfbaaaea42173b10f6ab6d53f30bc343f0485b4404100be1ddb1",
      "exclusive": true
    },
    {
      "type": "holds",
      "from": "unit",
      "to": "0xcd5cb00e788e869b9d22d63f40b2c9ede7c7af2f0ce4aff031d717f7317551b0",
      "quantity": {
        "amount": "100",
        "unit": "USD"
      },
      "scope": "visible, not withdrawable by the buyer while the tender is open"
    },
    {
      "type": "pledges",
      "from": "unit",
      "to": "0xcd5cb00e788e869b9d22d63f40b2c9ede7c7af2f0ce4aff031d717f7317551b0",
      "scope": "released to the worker on acceptance; refunded to the buyer on cancellation or expiry",
      "obligations": "release rule of the tender"
    },
    {
      "type": "commits",
      "from": "0x8cc9e1e24c33f29535cdcaec0e10455cf448a37d8f044192ac1557501f45ba19",
      "to": "0x7f20c153c6f7cfbaaaea42173b10f6ab6d53f30bc343f0485b4404100be1ddb1",
      "scope": "deliver the translated corpus before the deadline",
      "counterparty": "eip155:11155111:0x00000000000000000000000000000000000000b1"
    },
    {
      "type": "depends-on",
      "from": "unit",
      "to": "0xdaf6254620abe001082bf3066a11d6a6f1adedd33a311cd22ae3565163cd7c3c",
      "scope": "acceptance decision"
    },
    {
      "type": "exchanges",
      "from": "0xc7bb547165f109b0684969a62fdf1f8df8252cdb44134499298bfd4394ba6e0a",
      "to": "0xcd5cb00e788e869b9d22d63f40b2c9ede7c7af2f0ce4aff031d717f7317551b0",
      "scope": "funding of the bounty"
    },
    {
      "type": "exchanges",
      "from": "0xcd5cb00e788e869b9d22d63f40b2c9ede7c7af2f0ce4aff031d717f7317551b0",
      "to": "0x8cc9e1e24c33f29535cdcaec0e10455cf448a37d8f044192ac1557501f45ba19",
      "scope": "payout on acceptance"
    },
    {
      "type": "controls",
      "from": "0xdaf6254620abe001082bf3066a11d6a6f1adedd33a311cd22ae3565163cd7c3c",
      "to": "0xcd5cb00e788e869b9d22d63f40b2c9ede7c7af2f0ce4aff031d717f7317551b0",
      "scope": "acceptance releases the payout; rejection keeps the escrow"
    },
    {
      "type": "exchanges",
      "from": "0x8cc9e1e24c33f29535cdcaec0e10455cf448a37d8f044192ac1557501f45ba19",
      "to": "0xb7fc3da5b279228e2c9e999931d67656f6a1046e5e2a824f2661569e09b8c051",
      "scope": "submission"
    }
  ],
  "ports": [
    {
      "id": "bounty-in",
      "direction": "in",
      "class": "funds",
      "template": "auf:port:funds-in@1",
      "asset": "eip155:11155111/erc20:0x00000000000000000000000000000000000000cc",
      "conditions": "funding by the buyer while the tender is open"
    },
    {
      "id": "deliverable-in",
      "direction": "in",
      "class": "deliverable",
      "template": "auf:port:deliverable-in@1",
      "conditions": "submission by the accepted worker before the deadline"
    },
    {
      "id": "acceptance-in",
      "direction": "in",
      "class": "control",
      "template": "auf:port:control-in@1",
      "conditions": "acceptance or rejection by the acceptance authority within the judgment window"
    },
    {
      "id": "payout-out",
      "direction": "out",
      "class": "funds",
      "template": "auf:port:funds-out@1",
      "asset": "eip155:11155111/erc20:0x00000000000000000000000000000000000000cc",
      "conditions": "on acceptance, to the worker",
      "stateEffects": "escrow to zero, tender settled"
    },
    {
      "id": "refund-out",
      "direction": "out",
      "class": "funds",
      "template": "auf:port:funds-out@1",
      "asset": "eip155:11155111/erc20:0x00000000000000000000000000000000000000cc",
      "conditions": "on cancellation or expiry, to the buyer",
      "stateEffects": "escrow to zero, tender closed"
    }
  ],
  "authorities": {
    "definitionController": "eip155:11155111:0x00000000000000000000000000000000000000b1",
    "representatives": [
      {
        "account": "eip155:11155111:0x00000000000000000000000000000000000000d1",
        "scope": "acceptance decision only"
      }
    ],
    "beneficiaries": [
      {
        "account": "eip155:11155111:0x00000000000000000000000000000000000000c1",
        "scope": "payout on acceptance"
      },
      {
        "account": "eip155:11155111:0x00000000000000000000000000000000000000b1",
        "scope": "refund on cancellation or expiry"
      }
    ]
  },
  "validity": {
    "until": "2026-12-01T00:00:00Z"
  },
  "scale": {
    "window": "P30D"
  }
}
