{
  "auf": "1.0",
  "kind": "unit-definition",
  "unit": {
    "name": "Summarizer Skill Business",
    "summary": "A static executable skill owned by one party and licensed non-exclusively to three agents. Shows the difference between the asset, the usage rights of the licensees and the revenue rights of the owner.",
    "tags": [
      "skill",
      "licensing"
    ]
  },
  "elements": [
    {
      "kind": "skill",
      "ref": "eip155:11155111/erc721:0x00000000000000000000000000000000000000aa/1",
      "label": "Summarizer skill package v3 (token-bound executable skill)",
      "controller": "eip155:11155111:0x00000000000000000000000000000000000000f1"
    },
    {
      "kind": "service",
      "ref": "https://skills.example/summarizer/v3",
      "label": "Invocation endpoint of the skill",
      "extensions": {
        "x:auf.example:protocol-binding": {
          "protocol": "mcp",
          "transport": "https",
          "required": false
        }
      }
    },
    {
      "kind": "agent",
      "ref": "eip155:11155111:0x00000000000000000000000000000000000000a1",
      "label": "Licensee A"
    },
    {
      "kind": "agent",
      "ref": "eip155:11155111:0x00000000000000000000000000000000000000a2",
      "label": "Licensee B"
    },
    {
      "kind": "agent",
      "ref": "eip155:11155111:0x00000000000000000000000000000000000000a3",
      "label": "Licensee C"
    },
    {
      "kind": "financial-position",
      "ref": "urn:x:license:skill-1:licensee-a:2026",
      "label": "License fee receivable from A"
    },
    {
      "kind": "financial-position",
      "ref": "urn:x:license:skill-1:licensee-b:2026",
      "label": "License fee receivable from B"
    },
    {
      "kind": "financial-position",
      "ref": "urn:x:license:skill-1:licensee-c:2026",
      "label": "License fee receivable from C"
    },
    {
      "kind": "financial-position",
      "ref": "urn:x:payable:hosting:2026-10",
      "label": "Hosting invoice payable"
    },
    {
      "kind": "financial-position",
      "ref": "eip155:11155111:0x00000000000000000000000000000000000000e1",
      "label": "Treasury account (stable balance)"
    }
  ],
  "relations": [
    {
      "type": "owns",
      "from": "unit",
      "to": "0x3f13ce02d4a85ecacba5b5a5e6658105bf3f9208088d43b2d394a1c1ca00d656",
      "exclusive": true,
      "share": "1",
      "basis": [
        "eip155:11155111/erc721:0x00000000000000000000000000000000000000aa/1"
      ]
    },
    {
      "type": "commits",
      "from": "unit",
      "to": "0x590b6caa3dc99f05fa3fb9ad3a3d501b8cb9f54cefa7ec0cb23e39dfd93e94c4",
      "scope": "keep the endpoint available to licensees at the agreed service level",
      "obligations": "99.5% monthly availability"
    },
    {
      "type": "licenses",
      "from": "0xfcbebbecff638c8597fb0db7b30f0b9170d462dd1e26974e337738d06de72ac7",
      "to": "0x3f13ce02d4a85ecacba5b5a5e6658105bf3f9208088d43b2d394a1c1ca00d656",
      "scope": "inference calls, non-transferable, non-sublicensable",
      "exclusive": false,
      "validFrom": "2026-01-01T00:00:00Z",
      "validUntil": "2026-12-31T23:59:59Z",
      "basis": [
        "urn:x:agreement:eip155:11155111:0x00000000000000000000000000000000000000a1"
      ]
    },
    {
      "type": "holds",
      "from": "unit",
      "to": "0x7edb5c93b1a992d1ed031f45cb31d3099eb21ff20d4ee4cb968708d646b46aaa",
      "quantity": {
        "amount": "1200",
        "unit": "USD"
      },
      "scope": "annual license fee, paid monthly",
      "counterparty": "eip155:11155111:0x00000000000000000000000000000000000000a1"
    },
    {
      "type": "licenses",
      "from": "0x152142c5905bfb5c906be56b4b1f0dc0cbb461d32d8a94178172f0f12afa4d97",
      "to": "0x3f13ce02d4a85ecacba5b5a5e6658105bf3f9208088d43b2d394a1c1ca00d656",
      "scope": "inference calls, non-transferable, non-sublicensable",
      "exclusive": false,
      "validFrom": "2026-01-01T00:00:00Z",
      "validUntil": "2026-12-31T23:59:59Z",
      "basis": [
        "urn:x:agreement:eip155:11155111:0x00000000000000000000000000000000000000a2"
      ]
    },
    {
      "type": "holds",
      "from": "unit",
      "to": "0x9a3da9b87afac074bd561dc6f28ef12130f1a5ef99e085630be769826da9499e",
      "quantity": {
        "amount": "1200",
        "unit": "USD"
      },
      "scope": "annual license fee, paid monthly",
      "counterparty": "eip155:11155111:0x00000000000000000000000000000000000000a2"
    },
    {
      "type": "licenses",
      "from": "0x4681400ed361b8de87b7db945dd639ba7f09e62caae7a6e1e23e18ccda7faeb5",
      "to": "0x3f13ce02d4a85ecacba5b5a5e6658105bf3f9208088d43b2d394a1c1ca00d656",
      "scope": "inference calls, non-transferable, non-sublicensable",
      "exclusive": false,
      "validFrom": "2026-01-01T00:00:00Z",
      "validUntil": "2026-12-31T23:59:59Z",
      "basis": [
        "urn:x:agreement:eip155:11155111:0x00000000000000000000000000000000000000a3"
      ]
    },
    {
      "type": "holds",
      "from": "unit",
      "to": "0xe3d73cda65ffb378581c8e6ec40129b65ec251a0b938feb2fcaf1bbb3b5b7b6b",
      "quantity": {
        "amount": "1200",
        "unit": "USD"
      },
      "scope": "annual license fee, paid monthly",
      "counterparty": "eip155:11155111:0x00000000000000000000000000000000000000a3"
    },
    {
      "type": "owes",
      "from": "unit",
      "to": "0x7866a0f7476ff5de045940017d6d428c6d1fd8be077a1fd8af1f811d07fb0542",
      "quantity": {
        "amount": "30",
        "unit": "USD"
      },
      "scope": "due on receipt"
    },
    {
      "type": "holds",
      "from": "unit",
      "to": "0x1e753103d4a6e1908f5d7fb776a3b24e2b1b38a02165709adbdfd25bc34f6c1e"
    },
    {
      "type": "exchanges",
      "from": "0x590b6caa3dc99f05fa3fb9ad3a3d501b8cb9f54cefa7ec0cb23e39dfd93e94c4",
      "to": "0xfcbebbecff638c8597fb0db7b30f0b9170d462dd1e26974e337738d06de72ac7",
      "scope": "invocations"
    }
  ],
  "ports": [
    {
      "id": "service-out",
      "direction": "out",
      "class": "deliverable",
      "template": "auf:port:service-out@1",
      "conditions": "licensee holds a valid license"
    },
    {
      "id": "fees-in",
      "direction": "in",
      "class": "funds",
      "template": "auf:port:funds-in@1",
      "asset": "eip155:11155111/erc20:0x00000000000000000000000000000000000000cc",
      "account": "eip155:11155111:0x00000000000000000000000000000000000000e1",
      "conditions": "monthly license fee"
    },
    {
      "id": "hosting-out",
      "direction": "out",
      "class": "funds",
      "template": "auf:port:funds-out@1",
      "asset": "eip155:11155111/erc20:0x00000000000000000000000000000000000000cc",
      "account": "eip155:11155111:0x00000000000000000000000000000000000000e1",
      "conditions": "hosting invoices"
    }
  ],
  "authorities": {
    "definitionController": "eip155:11155111:0x00000000000000000000000000000000000000f1",
    "beneficiaries": [
      {
        "account": "eip155:11155111:0x00000000000000000000000000000000000000f1",
        "scope": "license revenue"
      }
    ],
    "settlementAccounts": [
      "eip155:11155111:0x00000000000000000000000000000000000000e1"
    ]
  },
  "validity": {
    "from": "2026-01-01T00:00:00Z",
    "until": "2026-12-31T23:59:59Z"
  },
  "scale": {
    "window": "P30D"
  }
}
