{
  "auf": "1.0",
  "kind": "unit-definition",
  "unit": {
    "name": "Agent B sub-unit",
    "summary": "Economic boundary of agent B inside Research Swarm Alpha. Holds half of the swarm's non-exclusive license to the summarizer skill.",
    "tags": [
      "agent",
      "sub-unit"
    ]
  },
  "elements": [
    {
      "kind": "agent",
      "ref": "eip155:11155111:0x00000000000000000000000000000000000000a2",
      "label": "Agent B"
    },
    {
      "kind": "skill",
      "ref": "eip155:11155111/erc721:0x00000000000000000000000000000000000000aa/1",
      "label": "Summarizer skill (shared license)"
    },
    {
      "kind": "financial-position",
      "ref": "eip155:11155111:0x00000000000000000000000000000000000000e3",
      "label": "Treasury of agent B"
    }
  ],
  "relations": [
    {
      "type": "licenses",
      "from": "unit",
      "to": "0x3f13ce02d4a85ecacba5b5a5e6658105bf3f9208088d43b2d394a1c1ca00d656",
      "scope": "inference calls under the swarm license",
      "exclusive": false,
      "share": "1/2",
      "basis": [
        "urn:x:agreement:swarm-license"
      ]
    },
    {
      "type": "holds",
      "from": "unit",
      "to": "0x874beddf623c4cd0d40c852a94b7a71026c468d2c29c6d933aaf2bc24387be54"
    },
    {
      "type": "controls",
      "from": "0x152142c5905bfb5c906be56b4b1f0dc0cbb461d32d8a94178172f0f12afa4d97",
      "to": "0x874beddf623c4cd0d40c852a94b7a71026c468d2c29c6d933aaf2bc24387be54",
      "scope": "spending policy of the sub-unit"
    }
  ],
  "ports": [
    {
      "id": "service-out",
      "direction": "out",
      "class": "deliverable",
      "template": "auf:port:service-out@1"
    },
    {
      "id": "funds-in",
      "direction": "in",
      "class": "funds",
      "template": "auf:port:funds-in@1",
      "asset": "eip155:11155111/erc20:0x00000000000000000000000000000000000000cc",
      "account": "eip155:11155111:0x00000000000000000000000000000000000000e3"
    }
  ],
  "authorities": {
    "definitionController": "eip155:11155111:0x00000000000000000000000000000000000000a2",
    "settlementAccounts": [
      "eip155:11155111:0x00000000000000000000000000000000000000e3"
    ]
  },
  "scale": {
    "window": "P7D"
  }
}
